<?xml version="1.0" encoding="UTF-8"?> 
<list xmlns:xsi="http://www.w3.org/2001/XMLSchema-instance" xsi:noNamespaceSchemaLocation="../xsd/Messages.xsd">
    <!-- voicedcommandhandlers  Messages -->
    <message id="dp_handler_usage_deposit_withdraw">
	    <set lang="en" val=".deposit (%s% Adena = %i% Goldbar) / .withdraw (%i% Goldbar = %s% Adena)" />
		<set lang="ru" val=".deposit (%s% Адена = %i% Золотые слитки) / .withdraw (%i% Золотые слитки = %s% Адена)" />
	</message>
	<message id="dp_handler_you_now_have_goldbar_and_adena">
	    <set lang="en" val="Thank you, you now have %i% Goldbar(s), and %s% less adena." />
		<set lang="ru" val="Спасибо, теперь у вас есть %i% Золотые слитки, и на %s% меньше Адены." />
	</message>
	<message id="dp_handler_you_not_have_enough_goldbars_convert">
	    <set lang="en" val="You do not have enough Adena to convert to Goldbar(s), you need %s% Adena." />
		<set lang="ru" val="У вас недостаточно Адены для конвертации в Золотые слитки, вам нужно %s% Адены." />
	</message>
	<message id="dp_handler_you_not_have_goldbars_into">
	    <set lang="en" val="You do not have any Goldbars to turn into %s% Adena." />
		<set lang="ru" val="У вас нет Золотых слитков, чтобы превратить в %s% Адену." />
	</message>
	<message id="dp_handler_usage_banchat_name">
	    <set lang="en" val="Usage: .banchat [name] [minutes]" />
		<set lang="ru" val="Применение: .banchat [name] [minutes]" />
	</message>
	<message id="dp_handler_player_not_online">
	    <set lang="en" val="Player not online!" />
		<set lang="ru" val="Игрока нет в онлайне!" />
	</message>
	<message id="dp_handler_player_already_punished">
	    <set lang="en" val="Player is already punished!" />
		<set lang="ru" val="Игрок уже наказан!" />
	</message>
	<message id="dp_handler_you_can_ban_yourself">
	    <set lang="en" val="You can't ban yourself!" />
		<set lang="ru" val="Вы не можете заблокировать чат себе!" />
	</message>
	<message id="dp_handler_you_can_ban_gm">
	    <set lang="en" val="You can't ban GM!" />
		<set lang="ru" val="Вы не можете заблокировать чат GM!" />
	</message>
	<message id="dp_handler_you_can_ban_moderator">
	    <set lang="en" val="You can't ban moderator!" />
		<set lang="ru" val="Вы не можете заблокировать чат модератору!" />
	</message>
	<message id="dp_handler_chat_banned_moderator">
	    <set lang="en" val="Chat banned by moderator %s%" />
		<set lang="ru" val="Чат заблокированый модератором %s%." />
	</message>
	<message id="dp_handler_player_chat_banned_for_minutes">
	    <set lang="en" val="Player %s% chat banned for %i% minutes." />
		<set lang="ru" val="Игроку %s% чат заблокирован на %i% минут(ы)." />
	</message>
	<message id="dp_handler_player_chat_banned_forever">
	    <set lang="en" val="Player %s% chat banned forever." />
		<set lang="ru" val="Игроку %s% чат заблокирован навсегда." />
	</message>
	<message id="dp_handler_player_not_found">
	    <set lang="en" val="Player not found!" />
		<set lang="ru" val="Игрок не найден!" />
	</message>
	<message id="dp_handler_usage_unbanchat_name">
	    <set lang="en" val="Usage: .unbanchat [name]" />
		<set lang="ru" val="Применение: .unbanchat [name]" />
	</message>
	<message id="dp_handler_player_not_chat_banned">
	    <set lang="en" val="Player is not chat banned!" />
		<set lang="ru" val="Игроку не заблокирован чат!" />
	</message>
	<message id="dp_handler_player_chat_unbanned">
	    <set lang="en" val="Player %s% chat unbanned." />
		<set lang="ru" val="Игроку %s% чат разблокирован." />
	</message>
	<message id="dp_handler_chat_unbanned_moderator">
	    <set lang="en" val="Chat unbanned by moderator %s%." />
		<set lang="ru" val="Чат разблокирован модератором  %s%." />
	</message>
	<message id="dp_handler_setvcmd_clan_privileges">
	    <set lang="en" val="Your clan privileges have been set to %s% by %i%." />
		<set lang="ru" val="Ваши права клана были установлены из %s% на %i%." />
	</message>
	<message id="dp_handler_usage_info_stats">
	    <set lang="en" val="Usage: .stats [player name]" />
		<set lang="ru" val="Применение: .stats [player name]" />
	</message>
    <message id="dp_handler_player_debug_on">
        <set lang="en" val="Debugging disabled." />
		<set lang="ru" val="Отладка отключена." />
    </message>
    <message id="dp_handler_player_debug_off">
        <set lang="en" val="Debugging enabled." />
		<set lang="ru" val="Отладка включена." />
    </message>
	<message id="dp_handler_lang_current_successfully">
        <set lang="en" val="Language successfully set to:" />
		<set lang="ru" val="Язык успешно изменен на:" />
    </message>
	<message id="dp_handler_hellbound_locked">
        <set lang="en" val="Hellbound is currently locked." />
		<set lang="ru" val="В настоящее время Остров Ада заблокирован." />
    </message>
    <message id="dp_handler_hellbound_level">
	    <set lang="en" val="Hellbound level: %s%" />
		<set lang="ru" val="Уровень Острова Ада: %s%" />
	</message>
</list>