<?xml version="1.0" encoding="UTF-8"?>
<!-- Seven Signs Messages -->
<list xmlns:xsi="http://www.w3.org/2001/XMLSchema-instance" xsi:noNamespaceSchemaLocation="../xsd/Messages.xsd">
    <message id="ss_teleported_nearest_seal">
        <set lang="en" val="You have been teleported to the nearest town due to the beginning of the Seal Validation period." />
		<set lang="ru" val="Вы были телепортированы в ближайший город из-за начала периода проверки печати." />
	</message>
    <message id="ss_teleported_nearest_cabal">
        <set lang="en" val="You have been teleported to the nearest town because you have not signed for any cabal." />
		<set lang="ru" val="Вы были телепортированы в ближайший город, потому что вы не подписались на период Борьбы." />
    </message>
    <message id="ss_festival_ended_time">
        <set lang="en" val="The Festival of Darkness will end in %s% minute(s)." />
		<set lang="ru" val="Фестиваль Тьмы закончится через %s% минут(ы)." />
    </message>
    <message id="ss_festival_ended">
        <set lang="en" val="The festival has ended. Your party leader must now register your score before the next festival takes place." />
		<set lang="ru" val="Фестиваль Тьмы закончился. Ваш лидер пати должен теперь зарегистрировать ваш счет до следующего фестиваля." />
    </message>
    <message id="ss_remove_player">
        <set lang="en" val="You have been removed from the festival arena." />
		<set lang="ru" val="Вы были удалены с арены Фестиваля Тьмы." />
    </message>
    <message id="ss_remove_party">
	    <set lang="en" val="%s% has been removed from the upcoming Festival." />
		<set lang="ru" val="%s% был снят с предстоящего Фестиваля Тьмы." />
	</message>
	<message id="ss_no_logout_player">
	    <set lang="en" val="You cannot log out while you are a participant in a Festival." />
		<set lang="ru" val="Вы не можете выйти, пока вы являетесь участником Фестиваля Тьмы." />
	</message>
	<message id="ss_no_restart_player">
        <set lang="en" val="You cannot restart while you are a participant in a festival." />
		<set lang="ru" val="Вы не можете перезайти, пока вы являетесь участником Фестиваля Тьмы." />
    </message>
    <message id="ss_no_resurrect_player">
	    <set lang="en" val="You may not resurrect participants in a festival." />
		<set lang="ru" val="Вы не можете воскрешать участников Фестиваля Тьмы." />
	</message>
	<message id="ss_no_sign_up">
	    <set lang="en" val="You cannot sign up while a festival is in progress." />
		<set lang="ru" val="Вы не можете зарегистрироваться во время Фестиваля Тьмы." />
	</message>
	<message id="ss_no_register">
        <set lang="en" val="You cannot register a score while a festival is in progress." />
		<set lang="ru" val="Вы не можете зарегистрировать счет во время Фестиваля Тьмы." />
    </message>
    <message id="ss_no_contribute">
        <set lang="en" val="You do not have any blood offerings to contribute." />
		<set lang="ru" val="У вас нет предложений крови, чтобы внести свой вклад." />
    </message>
    <message id="ss_no_leave_party">
	    <set lang="en" val="Only the party leader can leave a festival when a party has minimum number of members." />
		<set lang="ru" val="Лидер пати может покинуть Фестиваль Тьмы, когда пати имеет минимальное количество членов." />
	</message>
	<message id="ss_no_bonus">
	    <set lang="en" val="Bonuses cannot be paid during the competition period." />
		<set lang="ru" val="Бонусы не могут быть выплачены в течение периода соревнований." />
	</message>
</list>
	