<?xml version="1.0" encoding="UTF-8"?>
<!-- Events Messages -->
<list xmlns:xsi="http://www.w3.org/2001/XMLSchema-instance" xsi:noNamespaceSchemaLocation="../../xsd/Messages.xsd">
    <message id="event_you_want_participate_event">
        <set lang="en" val="Do you want to participating in the %s%?" />
		<set lang="ru" val="Желаете ли вы пригять участвие в %s%?" />
	</message>
    <message id="event_you_alredy_registred">
        <set lang="en" val="You are already registred!" />
		<set lang="ru" val="Вы уже зарегистрированы!" />
	</message>
	<!-- Status -->
	<message id="status_started">
	    <set lang="en" val="START" />
		<set lang="ru" val="Старт" />
	</message>
	<message id="status_finished">
	    <set lang="en" val="FINISHED" />
		<set lang="ru" val="Финиш" />
	</message>
</list>