<?xml version="1.0" encoding="UTF-8"?>
<!-- Server Test Messages -->
<list xmlns:xsi="http://www.w3.org/2001/XMLSchema-instance" xsi:noNamespaceSchemaLocation="../xsd/Messages.xsd">
    <message id="lang_current_successfully">
        <set lang="en" val="Language successfully set to:" />
		<set lang="ru" val="Язык успешно установлен на:" />
	</message>
    <message id="no_unstuck_in_jail">
        <set lang="en" val="You cannot use unstuck while you are in jail." />
		<set lang="ru" val="Вы не можете использовать бегство во время нахождения в тюрьме." />
    </message>
    <message id="unstuck_time_minutes">
        <set lang="en" val="You use Escape: %s% minutes." />
		<set lang="ru" val="Вы используете бегство: %s% минут." />
    </message>
    <message id="unstuck_time_seconds">
        <set lang="en" val="You use Escape: %s% seconds." />
		<set lang="ru" val="Вы используете бегство: %s% секунд." />
    </message>
    <message id="dp_handler_time">
        <set lang="en" val="Server time is: %s%" />
		<set lang="ru" val="Время сервера: %s%" />
    </message>
    <message id="dp_handler_hellbound_locked">
	    <set lang="en" val="Hellbound is currently locked." />
		<set lang="ru" val="В настоящее время Острова Ада заблокирован." />
	</message>
	<message id="dp_handler_hellbound_level">
	    <set lang="en" val="Hellbound level: %s%" />
		<set lang="ru" val="Уровень Острова Ада: %s%" />
	</message>
</list>
