<?xml version="1.0" encoding="UTF-8"?>
<list xmlns:xsi="http://www.w3.org/2001/XMLSchema-instance" xsi:noNamespaceSchemaLocation="../../xsd/Messages.xsd">
    <!-- Clan Messages -->
    <message id="clan_create_units_fail">
        <set lang="en" val="You can't create any more sub-units of this type." />
		<set lang="ru" val="Вы не можете создавать какие-либо подэлементы этого типа." />
	</message>
    <message id="clan_leader_fail">
        <set lang="en" val="Leader is not correct." />
		<set lang="ru" val="Лидер неверен." />
    </message>
    <message id="clan_alliance_done">
        <set lang="en" val="Alliance %s% has been created." />
		<set lang="ru" val="Создан Альянс %s%." />
    </message>
    <message id="clan_academy_member_grade">
        <set lang="en" val="You cannot change academy member grade." />
		<set lang="ru" val="Вы не можете изменить класс члена академии." />
    </message>
    <message id="clan_file_transfer_error">
        <set lang="en" val="File transfer error." />
		<set lang="ru" val="Ошибка передачи файлов." />
    </message>
    <message id="clan_no_such">
	    <set lang="en" val="No such clan." />
		<set lang="ru" val="Нет такого клана." />
	</message>
	<message id="clan_no_war">
	    <set lang="en" val="You aren't at war with this clan." />
		<set lang="ru" val="Вы не воюете с этим кланом." />
	</message>
	<!-- Clan Hall Messages -->
	 <message id="ch_no_owner">
        <set lang="en" val="This clan hall has no owner, you cannot change the configuration." />
		<set lang="ru" val="В этом клан-холле нет владельца, вы не можете изменить конфигурацию." />
    </message>
    <message id="ch_cursed_weapon">
        <set lang="en" val="The wielder of a cursed weapon cannot receive outside heals or buffs." />
		<set lang="ru" val="Владелец проклятого оружия не может получить в клан-холле исцеления или баффы." />
    </message>
	<!-- Clan Hall Sieges Messages -->
	 <message id="chs_level_restriction">
        <set lang="en" val="Only clans of level %s% or higher may register for a Siegable Hall." />
		<set lang="ru" val="Только кланы уровня %s% или выше могут зарегистрироваться на Осаждаемый Холл." />
    </message>
    <message id="no_register_defender">
        <set lang="en" val="You cannot register as a defender because %s% is owned by NPC." />
		<set lang="ru" val="Вы не можете зарегистрироваться как защитник, потому что %s% принадлежит NPC." />
    </message>
	<!-- Frestress Messages -->
	<message id="fort_no_owner">
        <set lang="en" val="This fortress has no owner, you cannot change the configuration." />
		<set lang="ru" val="У этой крепости нет владельца, вы не можете изменить конфигурацию." />
    </message>
	<!-- Castle Messages -->
	 <message id="castle_no_lord_open_door">
        <set lang="en" val="Only Castle doors can be open." />
		<set lang="ru" val="Только двери замка могут быть открыты." />
	</message>
    <message id="castle_no_lord_closed_door">
        <set lang="en" val="Only Castle doors can be closed." />
		<set lang="ru" val="Только двери замка могут быть закрыты." />
    </message>
    <message id="castle_no_clan_own">
        <set lang="en" val="Your clan does not own a castle." />
		<set lang="ru" val="У вашего клана нет замка." />
    </message>
    <message id="castle_gate_closed">
        <set lang="en" val="The gate is being closed." />
		<set lang="ru" val="Врата закрываются." />
    </message>
    <message id="castle_manor_deactivated">
        <set lang="en" val="Manor system is deactivated." />
		<set lang="ru" val="Система фермерства деактивирована." />
    </message>
	<!-- Territory War Messages -->
    <message id="tw_not_register">
	    <set lang="en" val="Non participants can't pickup Territory Wards!" />
		<set lang="ru" val="Не участники не могут забрать Территориальные палатки!" />
	</message>
	<message id="tw_register_id">
	    <set lang="en" val="Registred TerrId: %s%." />
		<set lang="ru" val="Зарегистрированные ТеррИд: %s%." />
	</message>
	<message id="tw_no_points">
	    <set lang="en" val="No points for you!" />
		<set lang="ru" val="Нет очков для вас!" />
	</message>
	<message id="tw_jobs">
	    <set lang="en" val="Your Territory's jobs:" />
		<set lang="ru" val="Работа вашей территории:" />
	</message>
</list>
 